{
  "findings": [],
  "generated_at": "2026-09-26T09:07:20Z",
  "input": {
    "format": "mmcif",
    "path": "tests/panel/5FQL.cif.gz",
    "sha256": "ac5ffc6fed697e7b2659f6747ad4d0638eb949220cd7ca7c8c3b372ce183f8d5"
  },
  "knowledge_base": {
    "sha256": "3f75fcd41d9d4b27faa59436e8a5c979ebdc5b951e244ca030cd0b3547430797",
    "version": "0.6.0"
  },
  "loops": [
    {
      "backbone": [
        {
          "ca_improper_degree": 34.9,
          "chain": "A",
          "ins_code": "",
          "phi_degree": -154.6,
          "psi_degree": 41.7,
          "res_name": "PHE",
          "seq_num": 444
        },
        {
          "ca_improper_degree": 30.2,
          "chain": "A",
          "ins_code": "",
          "phi_degree": 54.1,
          "psi_degree": 38.4,
          "res_name": "ARG",
          "seq_num": 445
        },
        {
          "ca_improper_degree": 20.0,
          "chain": "A",
          "ins_code": "",
          "phi_degree": -4.8,
          "psi_degree": 128.9,
          "res_name": "ASP",
          "seq_num": 446
        },
        {
          "ca_improper_degree": 31.6,
          "chain": "A",
          "ins_code": "",
          "phi_degree": -145.4,
          "psi_degree": -133.6,
          "res_name": "LEU",
          "seq_num": 447
        },
        {
          "ca_improper_degree": 34.3,
          "chain": "A",
          "ins_code": "",
          "phi_degree": -63.3,
          "psi_degree": -23.5,
          "res_name": "GLU",
          "seq_num": 448
        },
        {
          "ca_improper_degree": 19.1,
          "chain": "A",
          "ins_code": "",
          "phi_degree": 69.3,
          "psi_degree": -6.1,
          "res_name": "GLU",
          "seq_num": 449
        },
        {
          "ca_improper_degree": 33.2,
          "chain": "A",
          "ins_code": "",
          "phi_degree": 61.2,
          "psi_degree": -179.2,
          "res_name": "ASP",
          "seq_num": 450
        },
        {
          "ca_improper_degree": 21.0,
          "chain": "A",
          "ins_code": "",
          "phi_degree": -58.2,
          "psi_degree": -131.3,
          "res_name": "PRO",
          "seq_num": 451
        },
        {
          "ca_improper_degree": 31.2,
          "chain": "A",
          "ins_code": "",
          "phi_degree": 47.4,
          "psi_degree": 38.9,
          "res_name": "TYR",
          "seq_num": 452
        },
        {
          "ca_improper_degree": 20.3,
          "chain": "A",
          "ins_code": "",
          "phi_degree": -109.1,
          "psi_degree": 7.4,
          "res_name": "LEU",
          "seq_num": 453
        }
      ],
      "finding_id": "missing_residues/A:444-453",
      "flanks": [
        {
          "chain": "A",
          "ins_code": "",
          "res_name": "ARG",
          "seq_num": 443
        },
        {
          "chain": "A",
          "ins_code": "",
          "res_name": "PRO",
          "seq_num": 454
        }
      ],
      "label": "A:444-453",
      "note": "Modelled: no experimental support (occupancy 0.00). Analyses that rely on the experimental structure (contact maps, native-structure models) should treat these residues as modelled.",
      "peptide_bonds": [
        {
          "c_n_angstrom": 1.334,
          "ca_ca_angstrom": 3.804,
          "first": {
            "chain": "A",
            "ins_code": "",
            "res_name": "ARG",
            "seq_num": 443
          },
          "omega_degree": 179.7,
          "second": {
            "chain": "A",
            "ins_code": "",
            "res_name": "PHE",
            "seq_num": 444
          }
        },
        {
          "c_n_angstrom": 1.344,
          "ca_ca_angstrom": 3.831,
          "first": {
            "chain": "A",
            "ins_code": "",
            "res_name": "PHE",
            "seq_num": 444
          },
          "omega_degree": -177.2,
          "second": {
            "chain": "A",
            "ins_code": "",
            "res_name": "ARG",
            "seq_num": 445
          }
        },
        {
          "c_n_angstrom": 1.339,
          "ca_ca_angstrom": 3.812,
          "first": {
            "chain": "A",
            "ins_code": "",
            "res_name": "ARG",
            "seq_num": 445
          },
          "omega_degree": -179.0,
          "second": {
            "chain": "A",
            "ins_code": "",
            "res_name": "ASP",
            "seq_num": 446
          }
        },
        {
          "c_n_angstrom": 1.334,
          "ca_ca_angstrom": 3.79,
          "first": {
            "chain": "A",
            "ins_code": "",
            "res_name": "ASP",
            "seq_num": 446
          },
          "omega_degree": 179.8,
          "second": {
            "chain": "A",
            "ins_code": "",
            "res_name": "LEU",
            "seq_num": 447
          }
        },
        {
          "c_n_angstrom": 1.337,
          "ca_ca_angstrom": 3.854,
          "first": {
            "chain": "A",
            "ins_code": "",
            "res_name": "LEU",
            "seq_num": 447
          },
          "omega_degree": -179.8,
          "second": {
            "chain": "A",
            "ins_code": "",
            "res_name": "GLU",
            "seq_num": 448
          }
        },
        {
          "c_n_angstrom": 1.346,
          "ca_ca_angstrom": 3.862,
          "first": {
            "chain": "A",
            "ins_code": "",
            "res_name": "GLU",
            "seq_num": 448
          },
          "omega_degree": 179.4,
          "second": {
            "chain": "A",
            "ins_code": "",
            "res_name": "GLU",
            "seq_num": 449
          }
        },
        {
          "c_n_angstrom": 1.339,
          "ca_ca_angstrom": 3.826,
          "first": {
            "chain": "A",
            "ins_code": "",
            "res_name": "GLU",
            "seq_num": 449
          },
          "omega_degree": -179.8,
          "second": {
            "chain": "A",
            "ins_code": "",
            "res_name": "ASP",
            "seq_num": 450
          }
        },
        {
          "c_n_angstrom": 1.341,
          "ca_ca_angstrom": 3.851,
          "first": {
            "chain": "A",
            "ins_code": "",
            "res_name": "ASP",
            "seq_num": 450
          },
          "omega_degree": 179.5,
          "second": {
            "chain": "A",
            "ins_code": "",
            "res_name": "PRO",
            "seq_num": 451
          }
        },
        {
          "c_n_angstrom": 1.343,
          "ca_ca_angstrom": 3.85,
          "first": {
            "chain": "A",
            "ins_code": "",
            "res_name": "PRO",
            "seq_num": 451
          },
          "omega_degree": 179.9,
          "second": {
            "chain": "A",
            "ins_code": "",
            "res_name": "TYR",
            "seq_num": 452
          }
        },
        {
          "c_n_angstrom": 1.335,
          "ca_ca_angstrom": 3.804,
          "first": {
            "chain": "A",
            "ins_code": "",
            "res_name": "TYR",
            "seq_num": 452
          },
          "omega_degree": -179.7,
          "second": {
            "chain": "A",
            "ins_code": "",
            "res_name": "LEU",
            "seq_num": 453
          }
        },
        {
          "c_n_angstrom": 1.348,
          "ca_ca_angstrom": 3.879,
          "first": {
            "chain": "A",
            "ins_code": "",
            "res_name": "LEU",
            "seq_num": 453
          },
          "omega_degree": -179.7,
          "second": {
            "chain": "A",
            "ins_code": "",
            "res_name": "PRO",
            "seq_num": 454
          }
        }
      ],
      "residues": [
        {
          "atoms": [
            "N",
            "CA",
            "CB",
            "CG",
            "CD1",
            "CE1",
            "CZ",
            "CE2",
            "CD2",
            "C",
            "O"
          ],
          "chain": "A",
          "ins_code": "",
          "label_seq": 419,
          "res_name": "PHE",
          "seq_num": 444
        },
        {
          "atoms": [
            "N",
            "CA",
            "CB",
            "CG",
            "CD",
            "NE",
            "CZ",
            "NH1",
            "NH2",
            "C",
            "O"
          ],
          "chain": "A",
          "ins_code": "",
          "label_seq": 420,
          "res_name": "ARG",
          "seq_num": 445
        },
        {
          "atoms": [
            "N",
            "CA",
            "CB",
            "CG",
            "OD1",
            "OD2",
            "C",
            "O"
          ],
          "chain": "A",
          "ins_code": "",
          "label_seq": 421,
          "res_name": "ASP",
          "seq_num": 446
        },
        {
          "atoms": [
            "N",
            "CA",
            "CB",
            "CG",
            "CD1",
            "CD2",
            "C",
            "O"
          ],
          "chain": "A",
          "ins_code": "",
          "label_seq": 422,
          "res_name": "LEU",
          "seq_num": 447
        },
        {
          "atoms": [
            "N",
            "CA",
            "CB",
            "CG",
            "CD",
            "OE1",
            "OE2",
            "C",
            "O"
          ],
          "chain": "A",
          "ins_code": "",
          "label_seq": 423,
          "res_name": "GLU",
          "seq_num": 448
        },
        {
          "atoms": [
            "N",
            "CA",
            "CB",
            "CG",
            "CD",
            "OE1",
            "OE2",
            "C",
            "O"
          ],
          "chain": "A",
          "ins_code": "",
          "label_seq": 424,
          "res_name": "GLU",
          "seq_num": 449
        },
        {
          "atoms": [
            "N",
            "CA",